{
  "$schema": "https://nekoai.moe/schemas/neko-plugin.v2.json",
  "id": "com.nekoai.plugin.daily-briefing",
  "name": "Daily Ambient Briefing",
  "version": "1.0.0",
  "description": "Multi-source parallel read-only harvester across Calendar, Email, GitHub/Jira, and Git workspace status.",
  "author": "NekoAI Official",
  "license": "MIT",
  "category": "system",
  "tags": [
    "ambient",
    "harvester",
    "morning-routine"
  ],
  "platform": [
    "windows",
    "linux",
    "macos"
  ],
  "contributions": {
    "icon": "i-solar:sun-fog-bold-duotone"
  },
  "gateway": {
    "type": "native-app",
    "automationSurface": "native-api",
    "requiredPermissions": [
      "network:external",
      "filesystem:read"
    ]
  },
  "knowledge": {
    "promptInjection": "The Daily Briefing harvester aggregates ambient data across system sources using read-only APIs with zero side-effects."
  },
  "recipes": [
    {
      "id": "harvest-briefing",
      "name": "Harvest Daily Morning Briefing",
      "description": "Gathers upcoming calendar events, unread messages, and Git workspace changes into a structured daily briefing.",
      "riskLevel": "read_only",
      "inputs": {
        "includeCalendar": {
          "type": "boolean",
          "required": false,
          "default": true,
          "description": "Whether to query upcoming calendar agenda"
        },
        "includeEmail": {
          "type": "boolean",
          "required": false,
          "default": true,
          "description": "Whether to collect unread email summaries"
        },
        "includeGit": {
          "type": "boolean",
          "required": false,
          "default": true,
          "description": "Whether to inspect local Git workspace status"
        },
        "workspacePath": {
          "type": "string",
          "required": false,
          "description": "Path to target Git repository directory"
        }
      }
    }
  ]
}
